Title,Link,PropertyType,Price,Location,State,Bedrooms,Bathrooms,Area,Down_Payment,Payment_Method,Price_Per_M
600 sq m Villa for Sale in the Villas District,https://www.propertyfinder.eghttps://www.propertyfinder.eg/en/plp/buy/villa-for-sale-alexandria-hay-wasat-abis-el-asherah-hay-al-villat-st-8478694,Villa,25000000,Hay Al Villat St.,Abis El Asherah,7,4,600,0,Cash,41666.67
Apartment for sale inMustafa Kamel Abu Qir Street,https://www.propertyfinder.eghttps://www.propertyfinder.eg/en/plp/buy/apartment-for-sale-alexandria-hay-than-el-montazah-abu-qir-mostafa-kamel-st-8504649,Apartment,3300000,Mostafa Kamel St.,Abu Qir,2,1,125,0,Cash,26400.0
"Apartment for sale in Mustafa Kamel, Abu Qir Stree",https://www.propertyfinder.eghttps://www.propertyfinder.eg/en/plp/buy/apartment-for-sale-alexandria-hay-than-el-montazah-abu-qir-mostafa-kamel-st-8522367,Apartment,4400000,Mostafa Kamel St.,Abu Qir,2,1,158,0,Cash,27848.1
Villa for sale 1000m North Coast (Granada village),https://www.propertyfinder.eghttps://www.propertyfinder.eg/en/plp/buy/villa-for-sale-alexandria-hay-al-amereyah-adh-dheraa-al-bahri-alexandria-marsa-matrouh-road-8427714,Villa,10000000,Alexandria Marsa Matrouh Road,Adh Dheraa Al Bahri ـ,5,6,1000,0,Cash,10000.0
"Apartment for Sale, 218 sq m, Alex West Compound",https://www.bayut.eg/en/property/details-502907488.html,Apartment,13000000,Alex West,Agami,4,3,446,0,Cash,29147.98
Own a Distinctive Twin House Villa with Private Garden in Alex West – Alexandria's Prime Gated Community,https://www.bayut.eg/en/property/details-502990539.html,Twin House,19290000,Alex West,Agami,3,4,208,964500,Installments,92740.38
Receive immediately a twin house villa in Alex West,https://www.bayut.eg/en/property/details-502944840.html,Villa,15500000,Alex West,Agami,4,3,225,7750000,Installments,68888.89
Your opportunity now to own a unit in the finest projects at kilo 22 – *Alex West*,https://www.bayut.eg/en/property/details-502981739.html,Apartment,5259000,Alex West,Agami,2,1,111,262950,Installments,47378.38
"An amazing apartment on Qasr Al-Qweiri Street in one of the cleanest streets of Hanoville, with a very spacious area and all utilities available.",https://www.bayut.eg/en/property/details-502992153.html,Apartment,1250000,Al Hanouvel,Agami,3,1,120,0,Cash,10416.67
An Early Delivery 2Bedrooms Apartment In Alex WestAn Early Delivery 2Bedrooms Apartment In Alex West,https://www.bayut.eg/en/property/details-502969223.html,Apartment,7800000,Alex West,Agami,2,2,183,0,Cash,42622.95
An Early Delivery 3Bedrooms Apartment In Alex West,https://www.bayut.eg/en/property/details-502968939.html,Apartment,6800000,Alex West,Agami,3,2,155,0,Cash,43870.97
Own your unit in Alex West with discounts of up to 20% off market price and installment plans up to 5 years,https://www.bayut.eg/en/property/details-502969706.html,Apartment,6030400,Alex West,Agami,3,2,153,87174,Installments,39414.38
Roof Lqqqqqqta enjoys many features in a very special location.,https://www.bayut.eg/en/property/details-502933450.html,Apartment,1900000,Al Hanouvel,Agami,4,2,450,0,Cash,4222.22
Apartment for sale 153 m with a view directly overlooking the plaza.,https://www.bayut.eg/en/property/details-502992681.html,Apartment,5500000,Alex West,Agami,3,2,153,0,Cash,35947.71
"Apartment for sale, 278 sq m, Alex West Compound (Down payment: EGP 658,000 - 2 rows from the clubhouse)",https://www.bayut.eg/en/property/details-502997105.html,Apartment,13172000,Alex West,Agami,4,3,278,658000,Installments,47381.29
"Ground floor apartment with garden for sale, 153 sq m + 72 sq m garden, Alex West Compound (Plaza View)",https://www.bayut.eg/en/property/details-503013465.html,Apartment,10109880,Alex West,Agami,3,2,225,505464,Installments,44932.8
"Duplex apartment + roof 250m for sale in Alexandria Al-Nakheel, 6th of October Village, Al-Ajami, Kilometre 21",https://www.bayut.eg/en/property/details-503001165.html,Duplex,1300000,Agami,Agami,3,2,250,54166,Installments,5200.0
"Apartment for sale in Alexandria, Alex West Compound",https://www.bayut.eg/en/property/details-502968043.html,Villa,20081250,Alex West,Agami,3,2,116,156884,Installments,173114.22
Own your apartment with the nearest delivery and best price in Alex West,https://www.bayut.eg/en/property/details-502805189.html,Apartment,5500000,Alex West,Agami,3,3,184,0,Cash,29891.3
Luxury Investment with Installments up to 8 Years in Jezen Compound with 5% Down Payment,https://www.bayut.eg/en/property/details-503036782.html,Twin House,24905250,Alex West,Agami,7,5,289,194572,Installments,86177.34
Nearest delivery in Alex West View Open on Plaza,https://www.bayut.eg/en/property/details-502960135.html,Apartment,7882560,Alex West,Agami,3,2,153,270960,Installments,51520.0
Luxury standalone villa in Alex West 452m,https://www.bayut.eg/en/property/details-502984506.html,Villa,46373747,Alex West,Agami,10,4,452,2318687,Installments,102596.79
Your opportunity to own a unique villa with architectural design,https://www.bayut.eg/en/property/details-502958560.html,Villa,40276665,Alex West,Agami,6,6,421,2013833,Installments,95669.04
"Apartment for sale, 153 sq m, Alex West Compound (quarterly installment: EGP 178,000 - landscape view)",https://www.bayut.eg/en/property/details-503036584.html,Apartment,7650000,Alex West,Agami,3,2,153,1912000,Installments,50000.0
Premium Villa for Sale in Alex West – Antoniades Zone | Ready to Move,https://www.bayut.eg/en/property/details-502384315.html,Villa,35000000,Alex West,Agami,4,4,650,0,Cash,53846.15
"For sale, a 160 sqm super luxury apartment on Al-Arbaeen Street in the Bianchi area, Al-Baytach - Alexandria, Al-Agami",https://www.bayut.eg/en/property/details-502962366.html,Apartment,2700000,Al Bitash,Agami,3,2,160,0,Cash,16875.0
Apartment for sale 3 rooms in installments in Alexandria Al-Nakheel Village 6th October Al-Agami Kilometer 21,https://www.bayut.eg/en/property/details-503001137.html,Apartment,1050000,Agami,Agami,3,1,120,43750,Installments,8750.0
"Apartment for sale, 111 sq m, Alex West Compound (Down payment: EGP 265,000)",https://www.bayut.eg/en/property/details-503011252.html,Apartment,5300000,Alex West,Agami,2,1,111,265000,Installments,47747.75
"Luxury villa in Alex West, Alexandria 452m",https://www.bayut.eg/en/property/details-502997424.html,Villa,46373747,Alex West,Agami,10,4,452,2318687,Installments,102596.79
"Own a Luxury Twin House in the Heart of Alex West – Km 22, Alexandria",https://www.bayut.eg/en/property/details-503012352.html,Twin House,19250000,Alex West,Agami,3,2,300,962500,Installments,64166.67
apartment 217 m for sale in Alexwest open view,https://www.bayut.eg/en/property/details-503012423.html,Apartment,8100000,Alex West,Agami,4,3,217,3750000,Installments,37327.19
Luxury villa in Alex West with all integrated services 452m,https://www.bayut.eg/en/property/details-502966340.html,Villa,45527625,Alex West,Agami,10,4,452,2276381,Installments,100724.83
"For sale, a 1000m duplex villa registered in the area of Al-Hanafiya Street in the villa area, Al-Baytash - Al-Ajami.",https://www.bayut.eg/en/property/details-502992564.html,Villa,10000000,Al Bitash,Agami,6,5,1000,0,Cash,10000.0
Receive your apartment immediately in Alex West with an open landscape view,https://www.bayut.eg/en/property/details-502944471.html,Apartment,8750000,Alex West,Agami,3,3,218,7750000,Installments,40137.61
"Apartment for sale in Alex West Compound, Unit 184 (Down payment: EGP 425,000 - Delivery 2026)",https://www.bayut.eg/en/property/details-502862693.html,Apartment,8549000,Alex West,Agami,3,3,184,425000,Installments,46461.96
"For sale, a 160 sqm super ultra-luxury apartment on Al-Bashawat Street in the Bianchi area, Al-Bietaash - Alexandria, Al-Ajami.",https://www.bayut.eg/en/property/details-502994921.html,Apartment,2700000,Al Bitash,Agami,3,2,165,0,Cash,16363.64
Apartment for sale 165 meters in Al-Ajami Al-Baytash Bianchi ultra-lux finish,https://www.bayut.eg/en/property/details-502961780.html,Apartment,2100000,Al Bitash,Agami,3,2,165,0,Cash,12727.27
Apartment for sale - Alex West,https://www.bayut.eg/en/property/details-502989606.html,Apartment,6750000,Alex West,Agami,3,2,178,0,Cash,37921.35
Apartment for sale 153 m King Mariout (Alex West),https://www.bayut.eg/en/property/details-502917151.html,Apartment,6000000,Alex West,Agami,3,2,153,0,Cash,39215.69
"Apartment for sale in installments in Alexandria, 6th of October Village, Al-Ajami, Kilometer 21",https://www.bayut.eg/en/property/details-502907142.html,Apartment,1050000,Agami,Agami,2,1,125,43750,Installments,8400.0
Luxury villa for sale in Alex West with integrated services,https://www.bayut.eg/en/property/details-502988543.html,Villa,45527625,Alex West,Agami,10,4,452,2276381,Installments,100724.83
"A Distinctive Townhouse in Alex West, Alexandria – Invest or Live Now",https://www.bayut.eg/en/property/details-502917106.html,Townhouse,16650000,Alex West,Agami,4,4,200,832500,Installments,83250.0
"Apartment for sale, 155 sq m, Alex West Compound",https://www.bayut.eg/en/property/details-502917239.html,Apartment,8056900,Alex West,Agami,3,2,155,402845,Installments,51980.0
Apartment for sale 111 m King Maryout (Alex West),https://www.bayut.eg/en/property/details-502917354.html,Apartment,4635220,Alex West,Agami,2,1,111,188230,Installments,41758.74
"Apartment for sale, 155 sq m, Alex West Compound (Down payment: EGP 377,890)",https://www.bayut.eg/en/property/details-503011346.html,Apartment,7557800,Alex West,Agami,3,2,155,377890,Installments,48760.0
An Early Delivery Twin Villa In Jazzin - Alex West,https://www.bayut.eg/en/property/details-502969339.html,Twin House,9908000,Alex West,Agami,4,4,340,0,Cash,29141.18
"Apartment for sale, 178 sq m, Alex West (Prime Location)",https://www.bayut.eg/en/property/details-502962557.html,Apartment,6650000,Alex West,Agami,3,3,178,5500000,Installments,37359.55
Own an apartment now in Alex West and receive it within a year! Apartment 155m 3 rooms (see your unit in person),https://www.bayut.eg/en/property/details-502935572.html,Apartment,7530660,Alex West,Agami,3,2,155,106684,Installments,48584.9
"Apartment for sale with furniture and air conditioning in Alexandria, Al-Nakheel, Village 6 October, Al-Ajami, Kilometer 21",https://www.bayut.eg/en/property/details-502972238.html,Apartment,1400000,Agami,Agami,3,1,140,58300,Installments,10000.0
Luxurious standalone villa 452m in Alex West,https://www.bayut.eg/en/property/details-502988393.html,Villa,46373747,Alex West,Agami,10,4,452,2318687,Installments,102596.79
"Apartment for sale, 155 sq m, Alex West Compound (Down payment: EGP 360,000 - Delivery in one year)",https://www.bayut.eg/en/property/details-502897023.html,Apartment,7200000,Alex West,Agami,3,2,155,360000,Installments,46451.61
217 sqm apartment for sale in Alex West open view overlooking the plaza and the street with a lake view,https://www.bayut.eg/en/property/details-502798010.html,Apartment,8250000,Alex West,Agami,3,3,217,3900000,Installments,38018.43
"Apartment for sale in installments, first line in Alexandria, 6th October Village, Al-Ajami, kilometer 21",https://www.bayut.eg/en/property/details-502929512.html,Apartment,1600000,Agami,Agami,2,1,120,66600,Installments,13333.33
"Apartment for sale in Al-Raesi in Alexandria, Al-Nakhil, Village 6 October, Al-Ajami, Kilwa 21",https://www.bayut.eg/en/property/details-502999694.html,Apartment,800000,Agami,Agami,2,1,105,0,Cash,7619.05
"Apartment for sale, 111 sq m, Alex West Compound (Down payment: EGP 239,760 - Landscape view)",https://www.bayut.eg/en/property/details-503019905.html,Apartment,5300000,Alex West,Agami,2,1,111,239760,Installments,47747.75
Own your dream villa in Alex West – a strategic location with integrated services,https://www.bayut.eg/en/property/details-502990991.html,Townhouse,16800000,Alex West,Agami,3,3,196,840000,Installments,85714.29
Cash Offer with 3-Year Installments in Alex West,https://www.bayut.eg/en/property/details-502290474.html,Apartment,7000000,Alex West,Agami,3,3,184,3000000,Installments,38043.48
"Apartment for sale, 111 sq m, Alex West Compound (open landscape view)",https://www.bayut.eg/en/property/details-503034601.html,Apartment,5517000,Alex West,Agami,2,1,111,275850,Installments,49702.7
Your opportunity now to own a Quattro apartment in Alex West,https://www.bayut.eg/en/property/details-502773688.html,Apartment,11776000,Alex West,Agami,3,2,154,4121599,Installments,76467.53
A lovely apartment in a prime location at a surprising price,https://www.bayut.eg/en/property/details-503018094.html,Apartment,1400000,Al Hanouvel,Agami,3,1,130,0,Cash,10769.23
Closest delivery & below market price Own your apartment with an open plaza view in Alex West,https://www.bayut.eg/en/property/details-502945844.html,Apartment,4300000,Alex West,Agami,2,2,133,0,Cash,32330.83
Townhouse for sale in the Alex West project at an exceptional price,https://www.bayut.eg/en/property/details-502476216.html,Townhouse,19125000,Alex West,Agami,4,4,203,956250,Installments,94211.82
Apartment 178 m for sale in Alex West fully furnished,https://www.bayut.eg/en/property/details-503035857.html,Apartment,8100000,Alex West,Agami,3,3,178,2600000,Installments,45505.62
Your chance to book now before prices increase at Alex West Alexandria,https://www.bayut.eg/en/property/details-502985293.html,Apartment,7343000,Alex West,Agami,3,2,155,367150,Installments,47374.19
"Apartment for sale, 153 sq m, Alex West Compound",https://www.bayut.eg/en/property/details-502998535.html,Apartment,7400000,Alex West,Agami,3,2,153,370000,Installments,48366.01
"Apartment in Alexandria, Agami, 140 meters",https://www.bayut.eg/en/property/details-502990106.html,Apartment,1100000,Al Hanouvel,Agami,2,1,140,600000,Installments,7857.14
"Apartment for sale first line on the sea directly in Alexandria, 6 October, Armed Forces, Al-Ajami, Kilowat 21",https://www.bayut.eg/en/property/details-502952830.html,Apartment,1400000,Agami,Agami,2,1,110,0,Cash,12727.27
"Apartment for sale, 111 sq m, Alex West Compound",https://www.bayut.eg/en/property/details-503024241.html,Apartment,5260000,Alex West,Agami,2,1,111,263000,Installments,47387.39
"Apartment for sale first row on installment in Alexandria, Village 6 October, Armed Forces, Al-Ajami, Kilometer 21",https://www.bayut.eg/en/property/details-502913839.html,Apartment,1600000,Agami,Agami,2,1,118,66600,Installments,13559.32
Duplex villa 357m in Saint Catherine in Alexandria West compound,https://www.bayut.eg/en/property/details-503019203.html,Villa,18500000,Alex West,Agami,5,4,357,9736846,Installments,51820.73
Your opportunity to own a twin house villa in Alex West compound.,https://www.bayut.eg/en/property/details-502897218.html,Twin House,19240000,Alex West,Agami,2,3,300,962000,Installments,64133.33
"Chalet for sale at a special price, Bianchi",https://www.bayut.eg/en/property/details-502996960.html,Chalet,500000,Agami,Agami,2,1,148,0,Cash,3378.38
Receive immediately a twin house villa in Alex West with flexible payment plans,https://www.bayut.eg/en/property/details-502963981.html,Villa,15500000,Alex West,Agami,5,3,328,7750000,Installments,47256.1
"Apartment for sale, 153 sq m, Alex West Compound",https://www.bayut.eg/en/property/details-502984043.html,Apartment,5771160,Alex West,Agami,3,2,153,481000,Installments,37720.0
Apartment for sale 184 sqm Alex West immediate delivery at the old price,https://www.bayut.eg/en/property/details-502994531.html,Apartment,6500000,Alex West,Agami,3,3,184,0,Cash,35326.09
View your unit live at Alex West with 3-year payment plans,https://www.bayut.eg/en/property/details-502972782.html,Apartment,8250000,Alex West,Agami,4,3,217,3900000,Installments,38018.43
"Apartment for Sale, 178 sq m, Alex West Compound",https://www.bayut.eg/en/property/details-502884108.html,Apartment,7200000,Alex West,Agami,3,3,178,0,Cash,40449.44
"Apartment for Sale, 178 sq m, Alex West Compound",https://www.bayut.eg/en/property/details-502993455.html,Apartment,6883700,Alex West,Agami,3,3,178,3662500,Installments,38672.47
villa for sale 188 m in Alex west fully finished,https://www.bayut.eg/en/property/details-503006683.html,Villa,13000000,Alex West,Agami,3,2,188,0,Cash,69148.94
"For sale a 150m super lux apartment in the first street of Honey Month main, Al-Baytash - Alexandria Al-Ajami",https://www.bayut.eg/en/property/details-502974935.html,Apartment,1800000,Al Bitash,Agami,3,1,150,0,Cash,12000.0
"Apartment for sale in a lively location in Alexandria, 6th of October Village, Al-Najmi, Kilomete 21",https://www.bayut.eg/en/property/details-502929656.html,Apartment,850000,Agami,Agami,2,1,118,0,Cash,7203.39
"Apartment for Sale, 218 sq m, Alex West Compound",https://www.bayut.eg/en/property/details-502998434.html,Apartment,9000000,Alex West,Agami,4,3,218,8000000,Installments,41284.4
Your opportunity to live in an exceptional compound… 178m apartment in Alex West with 8 years installments and only 5% down payment.,https://www.bayut.eg/en/property/details-502897787.html,Apartment,9416000,Alex West,Agami,3,2,178,470800,Installments,52898.88
"For sale: a villa in Alex West, land 700 square meters",https://www.bayut.eg/en/property/details-502599242.html,Villa,33000000,Alex West,Agami,3,4,700,0,Cash,47142.86
"Apartment for sale with complete furnishings in Alexandria, 6 October, Al-Nakheel 1, Al-Ajami, Kilowatt 21",https://www.bayut.eg/en/property/details-503006287.html,Apartment,790000,Agami,Agami,2,1,100,0,Cash,7900.0
Own an apartment with immediate delivery in Alex West with an open view,https://www.bayut.eg/en/property/details-502985760.html,Apartment,6500000,Alex West,Agami,3,3,184,0,Cash,35326.09
184 m apartment for sale in Alex West with flexible payment over 2.5 years,https://www.bayut.eg/en/property/details-503008964.html,Apartment,7000000,Alex West,Agami,3,3,184,3650000,Installments,38043.48
Receive your townhouse with an open lake view immediately in Alex West,https://www.bayut.eg/en/property/details-502891917.html,Townhouse,13000000,Alex West,Agami,3,2,180,0,Cash,72222.22
"Apartment for sale, 217 sq m, Alex West Compound",https://www.bayut.eg/en/property/details-502978128.html,Apartment,7900000,Alex West,Agami,4,3,217,395000,Installments,36405.53
"For sale, a 130m super lux apartment on Al-Qaidah Street in the Baitash area - Alexandria, Al-Ajami.",https://www.bayut.eg/en/property/details-502974946.html,Apartment,950000,Al Bitash,Agami,3,1,130,0,Cash,7307.69
"Villa for sale 1,030 sqm in Alex West immediate delivery",https://www.bayut.eg/en/property/details-502993947.html,Villa,35000000,Alex West,Agami,6,6,1030,0,Cash,33980.58
"Apartment for sale, 155 sq m - (Alex West)",https://www.bayut.eg/en/property/details-502974164.html,Apartment,7700000,Alex West,Agami,3,3,155,47100,Installments,49677.42
Your apartment is in the heart of Alex West Compound – Alexandria,https://www.bayut.eg/en/property/details-502903190.html,Apartment,9200000,Alex West,Agami,3,3,184,460000,Installments,50000.0
Residential unit for sale 155m at Alex West.,https://www.bayut.eg/en/property/details-502982835.html,Apartment,5820000,Alex West,Agami,3,2,155,0,Cash,37548.39
Your opportunity at Alex West – receive it in just one year,https://www.bayut.eg/en/property/details-502958340.html,Apartment,7882000,Alex West,Agami,3,2,153,394100,Installments,51516.34
Resale Twin House Villa 290m in Alex West Compound,https://www.bayut.eg/en/property/details-502793510.html,Twin House,25500000,Alex West,Agami,4,4,470,0,Cash,54255.32
Apartment for sale 120 meters in the best location in Albeitash directly on the main street,https://www.bayut.eg/en/property/details-502961399.html,Apartment,1935000,Al Bitash,Agami,3,2,120,0,Cash,16125.0
"Apartment for sale, 153 sq m, Alex West Compound",https://www.bayut.eg/en/property/details-503014067.html,Apartment,5850000,Alex West,Agami,3,2,153,5000000,Installments,38235.29
"Apartment for sale, 155 sq m, Alex West Compound (Down payment: EGP 485,000 - Open view of the landscape)",https://www.bayut.eg/en/property/details-502976268.html,Apartment,5704000,Alex West,Agami,3,2,155,485000,Installments,36800.0
"Apartment for sale, 111 sq m, Alex West Compound (quarterly installment: EGP 133,000 - landscape view)",https://www.bayut.eg/en/property/details-503035300.html,Apartment,5717000,Alex West,Agami,2,1,111,1450000,Installments,51504.5
A real opportunity for housing or investment with a small down payment and flexible payment plans suitable for everyone.,https://www.bayut.eg/en/property/details-502893284.html,Apartment,5717000,Alex West,Agami,2,1,111,285850,Installments,51504.5
Own a 155 m apartment immediately in Alex West,https://www.bayut.eg/en/property/details-502974219.html,Apartment,5650000,Alex West,Agami,3,2,155,5330000,Installments,36451.61
"Apartment for sale, 111 sq m, Alex West Compound",https://www.bayut.eg/en/property/details-502992754.html,Apartment,5514000,Alex West,Agami,2,1,111,275000,Installments,49675.68
Last chance to own a premium Townhouse in *Gizen – Alex West*,https://www.bayut.eg/en/property/details-502966685.html,Townhouse,19125000,Alex West,Agami,3,3,200,956250,Installments,95625.0
"Receive your apartment immediately in Alex West, with a view overlooking the club",https://www.bayut.eg/en/property/details-502985156.html,Apartment,6300000,Alex West,Agami,3,2,155,0,Cash,40645.16
Receive immediately a villa with a distinctive area in Alex West in the best phase (Antoniades area),https://www.bayut.eg/en/property/details-502984937.html,Villa,35000000,Alex West,Agami,6,6,1030,0,Cash,33980.58
"Apartment for sale, 155 sq m, Alex West Compound (Down payment: EGP 363,630)",https://www.bayut.eg/en/property/details-503014761.html,Apartment,7272000,Alex West,Agami,3,2,155,363630,Installments,46916.13
"Twin house villa (v7) 327 m for sale, in Alex West Compound,",https://www.bayut.eg/en/property/details-502857203.html,Twin House,17000000,Alex West,Agami,3,3,327,0,Cash,51987.77
"Apartment for sale, 184 sq m, Alex West Compound",https://www.bayut.eg/en/property/details-503024278.html,Apartment,8549000,Alex West,Agami,3,2,184,427450,Installments,46461.96
Own your apartment in Alex West with installments over 3 years,https://www.bayut.eg/en/property/details-502973871.html,Apartment,8250000,Alex West,Agami,4,3,217,3900000,Installments,38018.43
"Standalone villa for sale, 393 sq m, Alex West Compound, Alexandria.",https://www.bayut.eg/en/property/details-502993262.html,Villa,40276665,Alex West,Agami,6,5,773,2013833,Installments,52104.35
Villa for sale 790 m with a swimming pool directly on the golf course,https://www.bayut.eg/en/property/details-502593778.html,Villa,35000000,Alex West,Agami,4,4,790,0,Cash,44303.8
Own a twin house villa with immediate delivery in Alex West,https://www.bayut.eg/en/property/details-502972247.html,Villa,15500000,Alex West,Agami,4,3,225,7750000,Installments,68888.89
With a 5% down payment and delivery within a year! A 183m apartment in Alex West (installment over 5 years),https://www.bayut.eg/en/property/details-502935844.html,Apartment,8754720,Alex West,Agami,3,3,183,124025,Installments,47840.0
Standalone villa with full amenities in Alex West Alexandria,https://www.bayut.eg/en/property/details-502942936.html,Villa,46373747,Alex West,Agami,10,4,452,2318687,Installments,102596.79
An apartment for sale 218 m in Alex west at the old price,https://www.bayut.eg/en/property/details-503008543.html,Apartment,8904864,Alex West,Agami,4,3,218,1345243,Installments,40848.0
"Apartment 153 m in Alex West Compound for 6,000,000 EGP",https://www.bayut.eg/en/property/details-502041942.html,Apartment,6000000,Alex West,Agami,3,2,153,0,Cash,39215.69
Standalone villa for sale in Alex West 452 sqm,https://www.bayut.eg/en/property/details-503008108.html,Villa,46373747,Alex West,Agami,10,4,452,2318687,Installments,102596.79
ِِApartment for sale 153 m in Alexwest for less than the market price,https://www.bayut.eg/en/property/details-503028756.html,Apartment,5300000,Alex West,Agami,3,2,153,0,Cash,34640.52
"Apartment with a roof for sale in Alexandria, Al Nakheel, 6 October Village, Al Agami, Kilometer 21",https://www.bayut.eg/en/property/details-502987876.html,Apartment,1070000,Agami,Agami,2,1,200,44583,Installments,5350.0
Luxury villa 452m in Alex West with integrated services,https://www.bayut.eg/en/property/details-502942978.html,Villa,45527625,Alex West,Agami,10,4,452,2276381,Installments,100724.83
Apartment for sale 217 m in Alexwest open view overlooking the lake,https://www.bayut.eg/en/property/details-503009562.html,Apartment,8250000,Alex West,Agami,4,3,217,3900000,Installments,38018.43
"Twin villa for sale, 357 sq m (Alex West Compound), prime location with lake view",https://www.bayut.eg/en/property/details-502968007.html,Twin House,18500000,Alex West,Agami,3,3,357,0,Cash,51820.73
"Apartment for sale, 153 sq m, Alex West Compound",https://www.bayut.eg/en/property/details-502988189.html,Apartment,6000000,Alex West,Agami,3,2,153,0,Cash,39215.69
Villa for Sale – 810 sqm – Alex West,https://www.bayut.eg/en/property/details-503027989.html,Villa,40000000,Alex West,Agami,4,5,810,0,Cash,49382.72
"Apartment for sale, 153 sq m, Alex West Compound, Alexandria (open view overlooking the largest plaza",https://www.bayut.eg/en/property/details-502789268.html,Apartment,7530660,Alex West,Agami,3,2,153,376533,Installments,49220.0
"Apartment for sale, 153 sq m, Alex West Compound (Down payment: EGP 360,000 - Delivery in one year)",https://www.bayut.eg/en/property/details-502998462.html,Apartment,7200000,Alex West,Agami,3,2,153,360000,Installments,47058.82
"For sale in the Jezzine area, a distinctive piece within the Alex West Compound Twin Villa, 289 square meters.",https://www.bayut.eg/en/property/details-503020673.html,Twin House,25129800,Alex West,Agami,4,3,289,588000,Installments,86954.33
"Apartment for sale, 217 sq m, Alex West Compound, Alexandria (open view)",https://www.bayut.eg/en/property/details-503028472.html,Apartment,8680500,Alex West,Agami,4,3,217,0,Cash,40002.3
